{
  "profile_id": "rules_default",
  "executive_name": "Maya Chen",
  "timezone": "America/Los_Angeles",
  "working_hours": {
    "days": ["monday", "tuesday", "wednesday", "thursday", "friday"],
    "start_time": "09:00",
    "end_time": "17:00",
    "timezone": "America/Los_Angeles"
  },
  "minimum_notice_hours": 24,
  "default_meeting_duration_minutes": 30,
  "meeting_type_priorities": {
    "intro": "medium",
    "internal": "medium",
    "customer": "high",
    "investor": "critical",
    "candidate": "high",
    "vendor": "low",
    "board": "critical",
    "personal": "medium",
    "other": "medium"
  },
  "preferred_meeting_days": ["tuesday", "wednesday", "thursday"],
  "avoid_time_windows": [
    {
      "label": "No meetings before prep time",
      "start_time": "09:00",
      "end_time": "10:00",
      "priority": "high"
    }
  ],
  "rules": [
    {
      "rule_id": "rule_customer_risk",
      "description": "Prioritize customer meetings about renewal or escalation risk.",
      "priority": "hard",
      "applies_to_meeting_types": ["customer"]
    }
  ],
  "updated_at": "2026-05-08T09:00:00-07:00"
}
